{
    "kfwProjectNoINPRO": 123456,
    "dataOwner": "Example Data Owner",
    "publishingRestrictions": "no",
    "locationName": "Example Location Name",
    "plannedOrActualStartDate": "2023-01-01",
    "plannedOrActualEndDate": "2023-12-31",
    "activityDescriptionGeneral": "A short description of the main project activity in this location.",
    "kcThemeSubSector": "Example Sub-Sector",
    "locationTypeName": "Example Location Type",
    "dac5PurposeCode": "12345",
    "geographicExactness": "exact",
    "latitude": 52.5200,
    "longitude": 13.4050,
    "filenameOfAdditionalGeoData": "example.kml",
    "primaryKey": 1
}